{
  "version": 1,
  "events": [
    "RawDocumentFetched",
    "DocumentNormalized",
    "DocumentUpdated",
    "DocumentDeleted",
    "IngestionCompleted"
  ],
  "sources": [
    { "event": "RawDocumentFetched", "service": "datasource-service" },
    { "event": "DocumentUpdated", "service": "document-service" },
    { "event": "DocumentDeleted", "service": "document-service" }
  ],
  "steps": [
    {
      "name": "convert",
      "service": "conversion-service",
      "consumer": "ConversionService.Features.ConversionJobs.Normalize.RawDocumentFetchedConsumer",
      "input": "RawDocumentFetched",
      "outputs": ["DocumentNormalized"],
      "enabled": true
    },
    {
      "name": "catalog",
      "service": "document-service",
      "consumer": "DocumentService.Features.Documents.Catalog.DocumentNormalizedConsumer",
      "input": "DocumentNormalized",
      "outputs": ["DocumentUpdated"],
      "enabled": true
    },
    {
      "name": "ingest",
      "service": "ingestion-service",
      "consumer": "IngestionService.Features.Ingestion.Ingest.DocumentUpdatedConsumer",
      "input": "DocumentUpdated",
      "outputs": ["IngestionCompleted"],
      "enabled": true
    },
    {
      "name": "ingestion-delete",
      "service": "ingestion-service",
      "consumer": "IngestionService.Features.Ingestion.RemoveDeleted.DocumentDeletedConsumer",
      "input": "DocumentDeleted",
      "outputs": [],
      "enabled": true
    },
    {
      "name": "wiki-sync",
      "service": "wiki-service",
      "consumer": "WikiService.Features.Wiki.SyncDocument.DocumentSyncConsumer",
      "input": "DocumentUpdated",
      "outputs": [],
      "enabled": true
    },
    {
      "name": "wiki-delete",
      "service": "wiki-service",
      "consumer": "WikiService.Features.Wiki.RemoveDeleted.DocumentDeletedConsumer",
      "input": "DocumentDeleted",
      "outputs": [],
      "enabled": true
    },
    {
      "name": "retrieval-delete",
      "service": "retrieval-service",
      "consumer": "RetrievalService.Features.Search.RemoveDeleted.DocumentDeletedConsumer",
      "input": "DocumentDeleted",
      "outputs": [],
      "enabled": true
    },
    {
      "name": "graph-delete",
      "service": "graph-service",
      "consumer": "GraphService.Features.GraphDocuments.Delete.DocumentDeletedConsumer",
      "input": "DocumentDeleted",
      "outputs": [],
      "enabled": true
    },
    {
      "name": "graph-sync",
      "service": "graph-service",
      "consumer": "GraphService.Features.GraphDocuments.Sync.GraphDocumentSyncConsumer",
      "input": "DocumentUpdated",
      "outputs": [],
      "enabled": true
    }
  ]
}
